{
  "$contract": "soter://contracts/doctor-result/v1",
  "contractVersion": "1.0.0",
  "id": "doctor.project-decision-resolution.fixture",
  "createdAt": "2026-07-22T12:00:00.000Z",
  "level": "offline",
  "configuration": {
    "name": "project-decision-resolution",
    "lockFingerprint": "sha256:3db0f966533e93ce8ad09631e2fa393acd512eaa96b6b85bdff0a0e4a4b4aa16"
  },
  "states": {
    "valid": "passed",
    "ready": "unknown",
    "verified": "unknown",
    "healthy": "unknown"
  },
  "checks": [
    {
      "id": "kernel.graph-valid",
      "claim": "Machine contracts and the selected dependency graph are internally valid.",
      "state": "passed",
      "evidenceIds": [],
      "details": "The dependency-free Kernel verifier reported no graph errors."
    },
    {
      "id": "core.lock-current",
      "claim": "The supplied lock exactly matches a fresh deterministic resolution.",
      "state": "passed",
      "evidenceIds": [
        "evidence.project-decision-resolution.resolution.fixture"
      ],
      "details": "The observed and freshly resolved lock fingerprints match."
    },
    {
      "id": "host.credentials-ready",
      "claim": "Required host credential references resolve with sufficient permissions.",
      "state": "skipped",
      "evidenceIds": [],
      "details": "Offline doctor does not inspect credential values or provider permissions."
    },
    {
      "id": "integrations.reachable",
      "claim": "Selected integrations are authenticated, reachable, and capability-compatible.",
      "state": "skipped",
      "evidenceIds": [],
      "details": "Offline doctor performs no network or provider calls."
    },
    {
      "id": "behavior.evidence-current",
      "claim": "Applicable fixture or stronger behavior evidence is current for every selected component.",
      "state": "unknown",
      "evidenceIds": [],
      "details": "Static declarations, test capacity, and run-scoped evidence do not establish complete behavior verification."
    },
    {
      "id": "runtime.health-current",
      "claim": "Connected dependencies are currently healthy for this configuration.",
      "state": "skipped",
      "evidenceIds": [],
      "details": "Current dependency health requires a connected or canary doctor level."
    }
  ],
  "diagnostics": [
    {
      "code": "SOTER_OFFLINE_SCOPE",
      "severity": "info",
      "claim": "Offline doctor reports only claims it can establish without provider access.",
      "subject": "project-decision-resolution",
      "path": [],
      "expected": "Readiness and live health remain unknown until connected checks run.",
      "observed": "Credential, reachability, capability, and current-health checks were skipped.",
      "evidenceIds": [
        "evidence.project-decision-resolution.resolution.fixture"
      ],
      "remediation": "Run a future connected doctor before executing provider capabilities."
    }
  ],
  "providerProbeIds": [],
  "evidenceIds": [
    "evidence.project-decision-resolution.resolution.fixture"
  ]
}
